{
  "schema_version": "js-work-packet-1",
  "canonicalization": "js-canonical-json-1",
  "program_sha256": "2813fb6f24f16e94e5bd610217785e8f10420ac4c1103693e63b3f250021d8ef",
  "fingerprint_sha256": "83dad1d7c68bbf1521ccaf56b6786ba634001608bb962bab2f1628e753a2363a",
  "manifest_sha256": "c4d288000610955c3dc1c7243a23fc13558f9f898c4da853fd3b3d41ba10daf8",
  "compiler": {
    "commit": "393904b9b92930058074019a5616097ec8ec2af8",
    "build_id": "jslice-m1.5-verifier-fixtures"
  },
  "schema_versions": {
    "machine": "js-machine-1",
    "manifest": "js-verification-1",
    "packet": "js-work-packet-1",
    "report": "js-verifier-report-1"
  },
  "paths": [],
  "temporary_structures": [],
  "datums": []
}
