{
  "schema_version": "js-work-packet-1",
  "canonicalization": "js-canonical-json-1",
  "program_sha256": "eaa30a70f9067f66d37d56525c9952585d697e043c85b88fb5255d9b5a16d2cd",
  "fingerprint_sha256": "83dad1d7c68bbf1521ccaf56b6786ba634001608bb962bab2f1628e753a2363a",
  "manifest_sha256": "dd4f754db23368ef14c071d99287b98cffa06769853cd4912fdd90357c319a36",
  "compiler": {
    "commit": "393904b9b92930058074019a5616097ec8ec2af8",
    "build_id": "jslice-m1.5-verifier-fixtures"
  },
  "schema_versions": {
    "machine": "js-machine-1",
    "manifest": "js-verification-1",
    "packet": "js-work-packet-1",
    "report": "js-verifier-report-1"
  },
  "paths": [],
  "temporary_structures": [],
  "datums": []
}
